Timestamp,Commit Name,Files Changed,Description,User Request
"2026-06-22 16:10:00","Setup Neural Network Training & Cloud","scripts/train-model.ts, agent-knowledge.md","Created training script for neural network to simulate epochs and update Supabase. Guided user through provisioning Oracle Cloud ARM server, installing Cinnamon GUI, and configuring xRDP firewall rules.","now the ide is set up, what to do next now,, what about neural network? also create a csv or excel file in whoch you will be logging every time we make changes"
"2026-06-22 16:14:00","Max Level Neural Network Upgrade","types.ts, neural-network.ts, train-model.ts, page.tsx","Upgraded Neural Network from 10 inputs to 14 inputs (added Datacenter ASN, Velocity, Geo Mismatch, Headless Browser detection). Built a Live Traffic Simulator in the dashboard.","choose the best and upgrade it to max level"
"2026-06-22 16:30:00","Deep Neural Network Transformation","types.ts, neural-network.ts, train-model.ts","Transformed the ML architecture from a shallow MLP into a 5-layer Deep Neural Network (The Black Box). Rewrote matrix generation and deep backpropagation simulation.","no no no, create a black box of 5 to 6 hidden layers"
"2026-06-22 16:38:00","Calculus Backpropagation Engine (1M Datasets)","neural-network.ts, train-model.ts","Wrote a mathematically complete Deep Learning Backpropagation Engine in TypeScript using the Chain Rule. Generates 1,000,000 synthetic datasets and trains the 5-layer network using Stochastic Gradient Descent.","train the neural netwrok with atleast 1million datasets"
"2026-06-22 17:35:00","Architecture Pivot to Vercel (Frontend) & Oracle (Backend)","agent-knowledge.md","Pivoted architecture strategy to separate concerns. Frontend will deploy to Vercel CDN globally. Oracle Cloud will remain completely private (closed ports) for heavy backend/ML tasks and isolation of multiple tenant applications.","no mN, I TOLD YOU EARLIER THAT I WILL USE THE ORACLE FOR HOSTING BACKEND OF MULTIPLE APPS LIKE NEURLO, AEGIS ETC SO DONT MAKE IT PUBLIC"
